Date,Bid,Descript
2017/8/4,000063.SZ,中兴通讯 PreG 产品 首次 突破 东南亚 最大 跨国 电信 运营商 新加坡 电信 
2017/8/4,000063.SZ,中兴通讯 牵头 组织 IEEEG 峰会 NOMA 专题讨论 推进 标准 制定 
2017/8/4,000063.SZ,通信 中兴 进一步 强化 重构 聚焦 战略 围绕 核心 业务 拓展 能力 打开 空间 
2017/8/4,000063.SZ,推荐 评级 通信 行业 投资 策略 报告 关注 细分 领域 聚焦 行业龙头 
2017/8/4,000063.SZ,通信 行业 深度 报告 人 的 物 联网 
2017/8/5,000063.SZ,多 目标 跟踪 突破 上交 大 中兴 MOTChallenge 测评 获 第一 
2017/8/7,000063.SZ,海通 朱 劲松 团队 中兴通讯 SZ 跟踪 报告 中兴 PreG 全球 广 部署 抢跑 G 时代 
2017/8/7,000063.SZ,招商 通信 每日 见闻 中国移动 启动 NBIoT 集采 金额 超亿 中兴通讯 首发 NBIoT 全频段 智能 停车 终端 
2017/8/7,000063.SZ,使能 全 连接 加速 数字化 转型 中兴通讯 CloudServCoreG 核心网 解决方案 
2017/8/7,000063.SZ,穿透 地下 三层 中兴通讯 首发 NB 
2017/8/7,000063.SZ,中兴通讯 网络 切片 端到 端 管理 CloudStudioEEO 
2017/8/7,000063.SZ,中兴通讯 PREG 产品 首次 突破 东南亚 最大 跨国 电信 运营商 
2017/8/8,000063.SZ,安信 通信 周报 基站 天线 再 获中 移动 加码 投资 中兴通讯 首次 突破 东南亚 最大 跨国 电信 运营商 
2017/8/8,000063.SZ,华创 通信 日报 中国移动 无源 器件 和 干线 放大器 集采 中兴通讯 南京 华脉 等 中标 
2017/8/8,000063.SZ,招商 通信 每日 见闻 中 移动 年 无源 器件 和 干放 集采 中兴 份额 第二 IIVI 收购 Kaiam 英国 英寸 晶圆产线 
2017/8/8,000063.SZ,增持 评级 通信 运营 行业 周报 通信 行业 迎来 变革 机遇 关注 联通 混改 和 移动 大规模 部署 NB 
2017/8/9,000063.SZ,小蓝 单车 牵手 中兴 开发 智能 锁 年内 将 落地 个 国家 近个 城市 
2017/8/9,000063.SZ,牛刀小试 中兴通讯 虚拟 路由器 助力 VEON 网络 虚拟化 改造 
2017/8/9,000063.SZ,中兴通讯 成立 抗震救灾 通讯 指挥部 协助 三大 运营商 保障 灾区 通 
2017/8/9,000063.SZ,中兴通讯 成立 四川 九寨 新疆 精河 抗震救灾 通讯 保障 联合 工作组 多批 抢险 专家 陆续 赶往 灾区 
2017/8/9,000063.SZ,中兴通讯 启动 应急 保障 方案 应对 九寨沟县 地震 
2017/8/9,000063.SZ,中兴通讯 与 运营商 协同作战 应急 保障 工作 已 展开 
2017/8/9,000063.SZ,中兴通讯 启动 应急 保障 方案 抢险 人员 携 物资 赶往 灾区 
2017/8/9,000063.SZ,新 通信 行业 周报 中 电信 拥抱 CORD 加速 白盒 交换机 产业 变革 中 移动 重金 采购 开启 NBIoT 大规模 部署 
2017/8/9,000063.SZ,深度 行业 新 通信 行业 周报 中 电信 拥抱 CORD 加速 白盒 交换机 产业 变革 中 移动 重 
2017/8/10,000063.SZ,中兴通讯 四川 九寨 地震 抢险 纪实 
2017/8/10,000063.SZ,协同作战 中兴通讯 全力 配合 四川 联通 抢险救灾 
2017/8/10,000063.SZ,中兴 自主 芯片 明年 商用 要 重回 国内 手机 前 三 
2017/8/10,000063.SZ,中兴通讯 成立 四川 九寨沟 新疆 精河 抗震救灾 通讯 保障 联合 工作组 
2017/8/10,000063.SZ,G 领先 布局 中兴通讯 全力支持 中国电信 建设 智慧 雄安 
2017/8/10,000063.SZ,深度 行业 通信 行业 点评 中 电信 重启 G 传输 设备 集采 传统 供应商 将 长期 受益 于 电信网 升 
2017/8/10,000063.SZ,通信 行业 点评 报告 从 电信 集采 看 下半年 G 传输网 建设 加速 
2017/8/11,000063.SZ,G 建设 承载 先行 中兴通讯 与 您 携手 迎向 G 承载 新 时代 
2017/8/12,000063.SZ,G 实力派 丨 中兴通讯 张建国 携手 拥抱 G 时代 
2017/8/13,000063.SZ,通信 行业 周报 联通 混改 方案 有望 近期 落地 电信 OTN 设备 集采量 大幅 增长 拉动 光 模块 及 器件 需求 同步 上升 
2017/8/14,000063.SZ,中兴通讯 深度 第三 弹 招商 通信 团队 中兴通讯 从 估值 角度 深度 剖析 公司 投资 价值 
2017/8/14,000063.SZ,中兴通讯 携手 四川 移动 开通 九寨 PreG 有力 保障 核心 震区 生命 通信 
2017/8/14,000063.SZ,中兴通讯 快评 移动 G 进展 并 不慢 中兴 将 是 边际 受益 最大 的 设备 商 
2017/8/14,000063.SZ,通信 行业 数据中心 需求 驱动 G 光 模块 快速 成长 中国移动 加码 NBIOT 
2017/8/14,000063.SZ,通信 行业 年 日常 报告 电信 启动 OTN 招标 移动 开启 物 联网 集采 
2017/8/15,000063.SZ,中兴通讯 云 视讯 云 桌面 产品 推介会 北京站 圆满 召开 
2017/8/15,000063.SZ,中兴通讯 G 标准 专家 再 获 嘉许 状 在 IEEE 标准 协会 影响力 提升 
2017/8/15,000063.SZ,通信 行业 周报 电信 启动 GOTN 设备 集采 关注 主 设备 商 投资 机会 
2017/8/16,000063.SZ,阜阳市 公安局 领导 一行 莅临 中兴通讯 调研 
2017/8/16,000063.SZ,华为 中兴 浪潮 等家 企业 通过 复核 成为 年 国家 技术创新 示范 企业 
2017/8/16,000063.SZ,推荐 评级 通信 行业 周报 移动 与 联通 上半年 业绩 增长 鹰潭 NB 
2017/8/17,000063.SZ,中兴通讯 与 中国 南京 软件 谷 管委会 共同 主办 光电子 产业 发展 促进 论坛 
2017/8/17,000063.SZ,中兴通讯 长沙 生产 基地 投入 运行 
2017/8/17,000063.SZ,中兴通讯 原 总裁 助理 徐明 出任 中兴 力维 执行 董事长 兼 CEO 
2017/8/17,000063.SZ,中兴 孟晓斌 ElasticNetOES 构建 云化 网络 运营 生态 
2017/8/17,000063.SZ,中信 建投 通信 联通 混改 第一 时间 深度 解读 联通 混改 落地 建议 关注 对 联通 与 行业 的 积极 影响 
2017/8/18,000063.SZ,美国 人 为啥 不用 华为 手机 因为 中兴 
2017/8/18,000063.SZ,强烈推荐 A 评级 中兴通讯 点评 从 爱立信 全球 大 裁员 看 中国 设备 商 G 时代 崛起 机遇 
2017/8/18,000063.SZ,中兴 陈杰 呼吁 业界 共同 提升 中国 光电子 产业 整体 竞争力 
2017/8/18,000063.SZ,中兴 手机 墙内 开花 墙外 香 美国 市场份额 增至 居 第四 
2017/8/18,000063.SZ,通信 行业 高 新兴 
2017/8/19,000063.SZ,增持 评级 通信 运营 行业 点评 智能化 与 云 计算 持续 推进 关注 AI 及云 计算 相关 投资 机会 
2017/8/20,000063.SZ,中兴 智能 摄像头 登陆 千岛 之 国 客户 盛赞 用户 体验 极佳 
2017/8/21,000063.SZ,努比亚 推出 GB 运存 手机 回应 中兴 减持 为 上市 做 准备 
2017/8/21,000063.SZ,买入 评级 中兴通讯 重大事件 快评 四大 通信 设备 商 上半年 成绩单 对比 浅析 
2017/8/21,000063.SZ,努比亚 Z 推 GB 版 发布 中兴 倪飞称 是 为 上市 准备 
2017/8/21,000063.SZ,倪飞 中兴 转让 股权 是 为 努比亚 上市 做 准备 
2017/8/21,000063.SZ,中兴 减持 至 努比亚 倪飞 为 上市公司 准备 
2017/8/21,000063.SZ,同步 大市 A 评级 通信 行业 动态分析 重度 应用 和 G 部署 驱动 网络 架构 变革 OTN 设备 市场 有望 迎来 新 增长点 
2017/8/21,000063.SZ,推荐 评级 通信 行业 周报 联通 混改 落地 募资 亿 BATJ 成为 战略 投资者 
2017/8/21,000063.SZ,领先 大市 A 评级 通信 行业 动态分析 中国移动 申请 FDD 牌照 物 联网 发展 再 加码 
2017/8/21,000063.SZ,买入 评级 通信 行业 周报 联通 混改 落地 关注 对 通信 行业 重大 影响 
2017/8/21,000063.SZ,光大 通信 田明华 团队 行业 周报 联通 混改 落地 关注 对 通信 行业 重大 影响 
2017/8/21,000063.SZ,增持 评级 通信 行业 周报 联通 混改 方案 出台 深挖 物 联网 数据 价值 
2017/8/22,000063.SZ,中信 建投 通信 长期 优势 系列 深度 研究 中兴通讯 深度 下三大 拐点 三大 布局 关注 全球 ICT 先锋 的 腾飞 
2017/8/22,000063.SZ,中兴通讯 关注 全球 ICT 先锋 的 腾飞 买入 评级 
2017/8/22,000063.SZ,超配 评级 通信 行业 重大事件 快 评物 联网 纵横谈 之 浅析 中兴通讯 的 物 联网 推进 之 路 
2017/8/22,000063.SZ,增持 评级 通信 运营 行业 周报 联通 公开 混改 方案 持续 关注 国企改革 以及 创新 业务 相关 投资 机会 
2017/8/23,000063.SZ,招商 通信 每日 见闻 中兴通讯 专家 当选 GPPRAN 副 主席 H 中国 光 网络设备 市场 同比 增长 
2017/8/23,000063.SZ,国产手机 品牌 纷至沓来 中兴 在 美国 的 成功 能否 复制 
2017/8/23,000063.SZ,中兴通讯 系列 研究 之五 中兴 到底 贵不贵 国君 通信 宋嘉吉 团队 
2017/8/23,000063.SZ,中兴通讯 专家 高音 当选 GPPRAN 副 主席 
2017/8/23,000063.SZ,中兴通讯 高音 当选 GPPRAN 副 主席 
2017/8/23,000063.SZ,看好 评级 通信 行业 周报 联通 复牌 激发 板块 走强 重点 关注 混改 品种 
2017/8/23,000063.SZ,通信 行业 联通 混改 落地 关注 对 通信 行业 重大 影响 
2017/8/23,000063.SZ,推荐 评级 通信 行业 信息 周报 联通 混改 开启 行业 改革 大幕 海外 需求 反倾销 政策 助力 光通信 持续 超 预期 从 爱立信 裁员 看 中国 设备 商 
2017/8/23,000063.SZ,通信 行业 周报 中国联通 发力 G 优化 升级 及 G 试 商用 建设 布局 GG 领域 的 通信 设备 商 有望 受益 
2017/8/24,000063.SZ,中兴通讯 上半年 净利 同比 增 三成 
2017/8/24,000063.SZ,中兴通讯 原 工会主席 何雪梅 等 人 被 批捕 涉嫌 挪用资金 
2017/8/24,000063.SZ,涉嫌 挪用资金 中兴通讯 原 工会主席 何雪梅 等 人 被 批捕 
2017/8/24,000063.SZ,中兴 上半年 净利 同比 增长 研发 投入 占 比达 丨 新 京报 财讯 
2017/8/24,000063.SZ,深圳 检察院 中兴通讯 原 工会主席 何雪梅 等 四人 被 批捕 
2017/8/24,000063.SZ,中兴通讯 半年报 增长 三成 
2017/8/24,000063.SZ,中兴通讯 股份有限公司 原 工会主席 何雪梅 等 四人 涉嫌 挪用资金 罪 被 批准逮捕 
2017/8/24,000063.SZ,中兴通讯 原 工会主席 何雪梅 等 四人 涉嫌 挪用资金 罪 被 批捕 
2017/8/24,000063.SZ,中兴通讯 蓄势 G 上半年 净利 
2017/8/24,000063.SZ,中兴通讯 蓄势 G 上半年 实现 净利 
2017/8/24,000063.SZ,中兴通讯 上半年 净利 同比 增 三成 将 强化 关键技术 方面 的 投入 
2017/8/24,000063.SZ,中兴通讯 上半年 营收 净利 
2017/8/24,000063.SZ,中兴通讯 原 工会主席 何雪梅 等 人 被 批捕 涉 挪用资金 罪 
2017/8/24,000063.SZ,中兴通讯 上半年 净利润 同比 增长 
2017/8/24,000063.SZ,中兴通讯 中期 多 赚 三成 至 亿人币 不 派息 
2017/8/24,000063.SZ,中兴通讯 上半年 净利 同比 增长 
2017/8/24,000063.SZ,中兴通讯 上半年 财报 出炉 净利润 同比 大涨 
2017/8/24,000063.SZ,中兴通讯 上半年 净利润 亿 同比 增长 
2017/8/24,000063.SZ,中兴通讯 HK 中期 纯利 亿 人民币 升 
2017/8/24,000063.SZ,中 报 中兴通讯 上半年 净利 增 三成 二季度 遭证金 公司 减持 
2017/8/24,000063.SZ,中兴通讯 上半年 净利润 人民币 同比 增长 
2017/8/24,000063.SZ,中兴通讯 蓄势 G 年 上半年 净利 同比 增长 
2017/8/24,000063.SZ,中兴通讯 上半年 净利 增 三成 二季度 遭证金 减持 
2017/8/24,000063.SZ,中兴通讯 上半年 净利 增成 二季度 遭证金 公司 减持 
2017/8/24,000063.SZ,中兴通讯 上半年 营收 净利 
2017/8/24,000063.SZ,中兴通讯 上半年 净利 增 三成 二季度 遭证金 公司 减持 
2017/8/24,000063.SZ,中兴通讯 运营商 和 手机 业务 向 好 亚欧 市场 开拓 顺利 
2017/8/24,000063.SZ,中兴通讯 年 上半年 净利 同比 增长 
2017/8/24,000063.SZ,强于 大 市 评级 通信 行业 周报 中国联通 发力 G 优化 升级 及 G 试 商用 建设 布局 GG 领域 的 通信 设备 商 有望 受益 
2017/8/25,000063.SZ,招商 通信 中兴通讯 业绩 超 预期 夯实 基础 走上 中兴 之 路 
2017/8/25,000063.SZ,增持 评级 中兴通讯 中 报 点评 治理 改善 超 预期 民资 话语权 提升 
2017/8/25,000063.SZ,买入 评级 中兴通讯 半年报 点评 中 报 业绩 高 增长 大 股东 增持 彰显 信心 
2017/8/25,000063.SZ,买入 评级 中兴通讯 HK 中报 点评 国内 运营商 和 海外 手机 业务 向 好 业绩 表现 符合 预期 
2017/8/25,000063.SZ,中性 评级 中兴通讯 HK 中报 点评 业绩 符合 预期 运营商 资本 开支 淡季 来临 维持 中性 
2017/8/25,000063.SZ,上半年 这块 业务 成 中兴通讯 收入 大头 全球 市场 格局 进一步 优化 
2017/8/25,000063.SZ,中兴通讯 上半年 盈利 多少 每天 净赚 分 分钟 买 套房 
2017/8/25,000063.SZ,强烈推荐 A 评级 中兴通讯 中 报 点评 业绩 超 预期 夯实 基础 走上 中兴 之 路 
2017/8/25,000063.SZ,买入 评级 中兴通讯 中 报 点评 业绩 符合 预期 长期 价值 投资 首选 
2017/8/25,000063.SZ,中兴通讯 业务 聚焦 持续 成长 净利润 更 有 质量 
2017/8/25,000063.SZ,中兴通讯 升近 半成 破 天线 中期 多 赚 三成 
2017/8/25,000063.SZ,海通 朱 劲松 团队 中兴通讯 半年报 点评 中 报 业绩 高 增长 大 股东 增持 彰显 信心 
2017/8/25,000063.SZ,中兴通讯 上半年 财报 净利 同比 增长 
2017/8/25,000063.SZ,中 新 赛克 将 冲击 IPO 年前 中兴 曾 是 它 的 控股 股东 
2017/8/25,000063.SZ,恩怨 情仇 年 华为 任正非 与 中兴 侯为 贵才 是 最好 的 对手 
2017/8/25,000063.SZ,中兴通讯 专家 高音 当选 GPPRAN 首位 女性 副 主席 
2017/8/25,000063.SZ,中兴 原 工会主席 何雪梅 被 批捕 因涉嫌 挪用资金 
2017/8/25,000063.SZ,中兴通讯 发布 财报 上半年 净利 同比 增长 
2017/8/25,000063.SZ,龙头 团队 首推 超 预期 中兴通讯 治理 改善 超 预期 民资 话语权 提升 国君 通信 宋嘉吉 团队 
2017/8/25,000063.SZ,中兴通讯 上半年 净利 增 近三成 
2017/8/25,000063.SZ,中 新 赛克 将 冲击 IPO 年前 中兴通讯 曾 是 其 控股 股东 
2017/8/25,000063.SZ,中 新 赛克 将 冲击 IPO 年前 中兴通讯 曾 是 它 的 控股 股东 
2017/8/25,000063.SZ,推荐 评级 通信 行业 点评 报告 中国移动 WDMOTN 集采 开启 OTN 招标 大幕 传输 建设 持续 推进 
2017/8/25,000063.SZ,通信 行业 动态分析 重度 应用 和 G 部署 驱动 网络 架构 变革 OTN 设备 市场 有望 迎来 新 增长点 
2017/8/26,000063.SZ,中兴通讯 发布 半年报 曝光 其 研发 力度 竟 在 这些 方面 当 了 排头兵 
2017/8/26,000063.SZ,中兴 政企 上半年 营收近 亿 主要 得益于 这 几 方面 的 布局 
2017/8/26,000063.SZ,安信 通信 中兴通讯 点评 半年报 超 预期 未来 G 更 可期 
2017/8/27,000063.SZ,中国联通 年 微站 微 RRU 集采 中兴通讯 豪取 半数 份额 
2017/8/27,000063.SZ,招商 通信 中兴 专家 高音 当选 GPPRAN 首位 女性 副 主席 G 商用 建设 加速 国务院 发文 推动 进程 
2017/8/27,000063.SZ,光大 通信 田明华 团队 中兴通讯 中 报 业绩 符合 预期 运营商 和 消费者 业务 向 好 
2017/8/27,000063.SZ,买入 评级 中兴通讯 半年报 点评 运营商 和 消费者 业务 双轮 驱动 业绩 平稳 上行 
2017/8/27,000063.SZ,买入 评级 中兴通讯 中 报 点评 运营商 业务 爆发 推动 上半年 业绩 超 预期 G 物 联网 布局 持续 发力 
2017/8/27,000063.SZ,光大 通信 田明华 团队 行业 周报 中 移动 启动 OTN 设备 集采 关注 主 设备 商 投资 机会 
2017/8/28,000063.SZ,买入 评级 深度 公司 中兴通讯 中 报 点评 规模 稳步 提升 业绩 大幅 向 好 
2017/8/28,000063.SZ,强烈推荐 评级 中兴通讯 中 报 点评 最 确定 最 受益 的 ICT 龙头 业绩 持续 高 增长 
2017/8/28,000063.SZ,中兴通讯 业绩 平稳 上行 买入 评级 
2017/8/28,000063.SZ,中兴通讯 长期 优势 系列 深度 研究 三大 拐点 三大 布局 关注 全球 ICT 先锋 的 腾飞 
2017/8/28,000063.SZ,中兴通讯 上半年 靠 运营商 业务 赚 了 多亿 毛利率 竟 超过 了 
2017/8/28,000063.SZ,买入 评级 中兴通讯 深度 报告 中兴 管理层 研究 任贤使能 周室 中兴 
2017/8/28,000063.SZ,买入 A 评级 中兴通讯 中 报 点评 半年报 超 预期 未来 G 更 可期 
2017/8/28,000063.SZ,中兴通讯 深度 中兴 管理层 研究 任贤使能 周室 中兴 
2017/8/28,000063.SZ,中兴通讯 徐力 团队 运营商 业务 爆发 推动 上半年 业绩 超 预期 G 物 联网 布局 持续 发力 
2017/8/28,000063.SZ,东吴 晨报 宏观 月 工业 企业 财务数据 点评 个股 中国 人寿 汇川 技术 五粮液 天奇 股份 华孚色 纺长 电 科技 中兴通讯 等 
2017/8/28,000063.SZ,中兴通讯 三大 拐点 三大 布局 全年 净利 将 高 增长 
2017/8/28,000063.SZ,超配 评级 通信 行业 重大事件 快 评物 联网 纵横谈 之 华为 引领 NB 
2017/8/28,000063.SZ,增持 评级 通信 行业 周报 物 联网 计划 为 联通 混改 创新 落地 第一步 华为 发布 NFV 网络 保障 技术 白皮书 
2017/8/28,000063.SZ,增持 评级 通信 行业 周报 联通 成立 物 联网 产业 联盟 运营商 再启 设备 集采 项目 
2017/8/28,000063.SZ,推荐 评级 通信 行业 周报 中国移动 OTN 设备 集采 规模 近几年 最大 年集 采约 万物 联网 宏站 
2017/8/28,000063.SZ,通信 行业 年 月 月 报 月 计算机 通信 领涨 后续 仍 看好 人工智能 物 联网 及 G 等 
2017/8/28,000063.SZ,领先 大市 A 评级 通信 行业 周报 国务院 发文 加快 G 产业 推进 中国移动 集采 OTN 光 传输 
2017/8/28,000063.SZ,增持 评级 通信 行业 年 日常 报告 G 进程 明确 中国 设备 商 中期 持续增长 
2017/8/28,000063.SZ,增持 评级 通信 设备 制造 行业 周报 G 年 商用 物 联网 规模 部署 在 即 
2017/8/28,000063.SZ,通信 行业 研究 G 进程 明确 中国 设备 商 中期 持续增长 
2017/8/29,000063.SZ,分析师 点评 中兴通讯 半年报 G 成功 可为 G 打好 基础 
2017/8/29,000063.SZ,中兴通讯 发布 半年报 在 无线 领域 表现 如何 
2017/8/29,000063.SZ,通信 中兴通讯 规模 稳步 提升 业绩 大幅 向 好 
2017/8/29,000063.SZ,增持 评级 通信 行业 一周 谈三大 运营商 中 报 解读 实际 投资 超 预期 
2017/8/29,000063.SZ,推荐 评级 通信 行业 周报 移动 OTN 集采 信息 消费 升温 
2017/8/29,000063.SZ,推荐 评级 通信 行业 周报 联通 召开 物 联网 生态 大会 混改 完成 加速 布局 物 联网 
2017/8/29,000063.SZ,超配 评级 通信 行业 重大事件 快 评主 设备 集采 启动 NB 
2017/8/29,000063.SZ,通信 行业 研究 周报 联通 混改 落地 激活 国改 预期 基本面 与 概念 板块 并重 
2017/8/30,000063.SZ,中性 评级 中兴通讯 HK 路演 纪要 聚焦 电信 设备 业务 积极 提高 海外 市占率 
2017/8/30,000063.SZ,中兴 聘用 前 美国 监管 官员 加强 与 美 沟通 渠道 
2017/8/30,000063.SZ,安信 通信 通信 行业 年 中报 深度 解析 行业 Q 业绩 平稳 增长 中长期 看好 G 光通信 和物 联网 
2017/8/30,000063.SZ,推荐 评级 通信 行业 简评 报告 国务院 加快 发展 信息 消费 关注 光 器件 G 与物 联网 
2017/8/31,000063.SZ,年 电信 集采 MSE 集采 公示 中兴通讯 综合排名 第一 
2017/8/31,000063.SZ,领先 大市 A 评级 通信 行业 深度 分析 通信 行业 Q 业绩 平稳 增长 中长期 看好 G 光通信 和物 联网 
2017/8/31,000063.SZ,通信 行业 国务院 发文 加快 G 产业 推进 
2017/9/1,000063.SZ,国泰君安 国际 港股 交易 参考 中兴通讯 HK 
2017/9/1,000063.SZ,强烈推荐 A 评级 中兴通讯 点评 聘任 美国商务部 前 高官 完善 美国市场 合规 及 销售 体系 
2017/9/3,000063.SZ,招商 通信 中兴 聘用 美 前任 高官 夯实 国际市场 高 新兴 中 报 亮丽 超 预期 物 联网 一体化 格局 显现 移动 携手 中电科 共同 推进 G 高 频段 发展 
2017/9/3,000063.SZ,中兴通讯 校园 招聘 高管 宣讲会 即将 启动 
2017/9/3,000063.SZ,通信 运营 行业 物 联网 部署 持续 发力 华为 云 战略 火力 全开 建议 关注 相关 投资 机会 
2017/9/4,000063.SZ,中兴 柏燕民 优化 G 体验 高低 频段 需要 智慧 搭配 
2017/9/4,000063.SZ,强烈推荐 A 评级 通信 行业 信息 周报 中兴 聘用 美 前任 高官 夯实 全球 市场 移动 携手 中电科 共同 推进 G 高 频段 发展 
2017/9/4,000063.SZ,安信 通信 每周 观点 通信 行业 Q 业绩 平稳 增长 中国电信 物 联网 商用 再拔 头筹 
2017/9/4,000063.SZ,推荐 评级 通信 行业 周报 通信 行业 Q 业绩 回暖 关注 基本面 改善 与 业绩 持续 强 的 细分 领域 
2017/9/4,000063.SZ,增持 评级 深度 行业 新 通信 行业 周报 运营商 传输 设备 集采 陆续 重启 电信 与 数通 领域 光通信 需求 长期 强劲 
2017/9/4,000063.SZ,增持 评级 通信 设备 制造 行业 周报 华为 云 业务 跳级 物 联网 规模 部署 在 即 
2017/9/4,000063.SZ,通信 行业 光 博会 带动 G 升温 关注 低 估值 成长 
2017/9/4,000063.SZ,华创 通信 束 海峰 团队 通信 中 报 解析 光通信 依旧 强劲 专网 S IP电话 终端 行业 持续 景气 
2017/9/5,000063.SZ,年 通信业 中 报 综述 行业 二季度 盈利 有所改善 持续 关注 细分 领域 机会 
2017/9/6,000063.SZ,优于 大势 评级 通信 行业 周报 运营商 设备 商 加速 G 推进 相关 标的 持续 受益 
2017/9/6,000063.SZ,领先 大市 A 评级 通信 行业 动态分析 通信 行业 Q 业绩 平稳 增长 中国电信 物 联网 商用 再拔 头筹 
2017/9/7,000063.SZ,中兴通讯 蓄势 G 引领 产业 发展 
2017/9/7,000063.SZ,中兴通讯 发布 人工智能 解决方案 助力 下一代 网络 建设 
2017/9/7,000063.SZ,蓝剑 计划 邀 你 闯关 中兴通讯 校园 招聘 创新 启航 
2017/9/7,000063.SZ,通信 行业 运营商 设备 商 加速 G 推进 相关 标的 持续 受益 
2017/9/8,000063.SZ,中兴通讯 成功 举办 中国 开源 云 联盟 WG 桌面 云 工作组 会议 
2017/9/8,000063.SZ,股 焦点 中兴通讯 升明 年底 前 部署 预 商用 
2017/9/8,000063.SZ,中兴通讯 赵福川 加速 G 承载 标准 建立 推动 G 规模 部署 
2017/9/8,000063.SZ,中兴 明 年底 前 部署 G 预 商用 
2017/9/8,000063.SZ,强强 联手 跨界 合作 茅台 集团 领导 莅临 中兴通讯 总部 参观 考察 
2017/9/8,000063.SZ,推荐 评级 通信 行业 周报 华为 云 业务 升 为 一级 部门 加快 布局 云 计算 领域 
2017/9/8,000063.SZ,通信 行业 光通信 统一 通信 依然 高 景气 关注 物 联网 和 G 机会 
2017/9/8,000063.SZ,强于 大 市 评级 通信 行业 专题研究 连续 季 增长 但 放缓 关注 光通信 专网 与物 联网 
2017/9/11,000063.SZ,中兴通讯 家 机构 蜂拥 调研 中兴通讯 受 机构 扎堆 关注 
2017/9/11,000063.SZ,中兴通讯 赴约 美洲 移动 通信 大会 G 端到 端 产品 创新 呈现 
2017/9/11,000063.SZ,G 实力派 中兴通讯 G 四大 领域 火力 全开 
2017/9/11,000063.SZ,中兴通讯 深度 中兴通讯 AI 最新进展 深度 研究 
2017/9/11,000063.SZ,安信 通信 每周 观点 光 博会 点燃 G 光通信 行业 热情 全面 看好 光通信 中长期 成长 
2017/9/11,000063.SZ,推荐 评级 通信 行业 年 中报 总结 二季度 盈利 情况 改善 把握 运营商 资本 开支 结构 优化 
2017/9/11,000063.SZ,增持 评级 通信 运营 行业 周报 云网 协同 成 发展 大势 持续 关注 物 联网 云 计算 大 数据 及 网络安全 相关 投资 机会 
2017/9/11,000063.SZ,增持 评级 通信 行业 周报 工信部 发布 无线电 频率 划分 草案 联通 混改 瘦身 落地 迅速 
2017/9/11,000063.SZ,增持 评级 通信 设备 制造 行业 周报 华为 云 连接 大会 物 联网 成 关注 焦点 
2017/9/11,000063.SZ,通信 行业 研究 智能 联接 与 G 传输 带动 行业 创新 
2017/9/12,000063.SZ,推荐 评级 通信 行业 周报 中兴通讯 蓄势 G 年 年底 前 部署 G 预 商用 
2017/9/12,000063.SZ,中兴通讯 在 布达佩斯 举办 的 创新 日 
2017/9/12,000063.SZ,通信 行业 中 报收 官 白马 龙头 业绩 屡超 预期 把握 趋势 和 确定性 
2017/9/12,000063.SZ,行业 研报 精选 关注 通信 行业 光 网络 产业链 投资 机会 
2017/9/12,000063.SZ,优于 大势 评级 通信 行业 周报 工信部 拟定 G 频段 光通信 持续 火热 
2017/9/12,000063.SZ,领先 大市 A 评级 通信 行业 动态分析 光 博会 点燃 G 光通信 行业 热情 全面 看好 光通信 中长期 成长 
2017/9/13,000063.SZ,中兴通讯 在 匈 举办 创新 日 聚焦 技术 
2017/9/13,000063.SZ,通信 行业 苹果 新品 发布 通信 产业链 再迎 四大 机遇 
2017/9/13,000063.SZ,推荐 评级 通信 行业 周报 光通信 投资 机遇 向 纵深 方向 演进 
2017/9/14,000063.SZ,中兴通讯 亮相 首届 美洲 移动 通信 大会 
2017/9/14,000063.SZ,国泰君安 国际 中兴通讯 准 G 网络 推出 的 支持 中性 
2017/9/14,000063.SZ,中兴通讯 G 研发 成果 走进 匈牙利 
2017/9/14,000063.SZ,通信 行业 年 中报 综述 第二季度 营收及 净利润 增速 好于 第一季度 关注 细分 领域 龙头 
2017/9/15,000063.SZ,安信 通信 日报 中兴 华为 成 中国移动 年物 联网 专网 核心网 四期 集采 大赢家 
2017/9/15,000063.SZ,华为 千亿 级云 计算 产业 落户 城市 确定 思科 中兴 前 几月 刚 投 完钱 
2017/9/15,000063.SZ,中国移动 年物 联网 专网 核心网 四期 集采 结果 中兴 华为 成 大赢家 
2017/9/15,000063.SZ,通信 行业 连续 季 增长 但 放缓 关注 光通信 专网 与物 联网 
