Date,Bid,Descript
2015/4/13,000063.SZ,从 中兴 看 中国 品牌 如何 出海 
2015/4/13,000063.SZ,中兴 无线 充电 技术 获 CITE 创新 金奖 相关 概念 值得 关注 
2015/4/14,000063.SZ,中兴通讯 香港 减持 中国 全通 万股 套现 万 港币 
2015/4/15,000063.SZ,中兴通讯 荣获 年 中国 十大 绿色 数据中心 奖 
2015/4/15,000063.SZ,中兴通讯 G 关键技术 MUSA 和 UDN 研发 取得 新进展 
2015/4/16,000063.SZ,中信证券 中兴通讯 等 股票 资金 流速 居前 
2015/4/16,000063.SZ,工信部 表态 将 深入 落实 宽带 中国 战略 通信 行业 望 持续 景气 
2015/4/17,000063.SZ,中兴通讯 三重 机遇 齐现 中兴 迎来 战略 机遇期 
2015/4/17,000063.SZ,大 行 报告 瑞信 重申 中兴 HK 跑 赢大市 评级 目标价 上调 至元 
2015/4/17,000063.SZ,中兴 渠道 新理念 互联网 时代 的 开放平台 
2015/4/20,000063.SZ,胜利 证券 予 中兴通讯 持有 评级 看 港元 
2015/4/20,000063.SZ,教育部 中兴通讯 ICT 产教 融合 创新 基地 项目 一期 签约 仪式 顺利 达成 
2015/4/20,000063.SZ,胜利 证券 维持 中兴通讯 持有 评级 
2015/4/20,000063.SZ,国泰君安 中兴通讯 增持 评级 关注 
2015/4/21,000063.SZ,中兴通讯 中国 一重 等 股票 资金 流速 居前 
2015/4/21,000063.SZ,中兴通讯 推 更 先进 的 新 多址 技术 
2015/4/21,000063.SZ,中兴通讯 为 满足 巴基斯坦 人民 的 需求 而 默默 奉献 
2015/4/22,000063.SZ,中兴通讯 SDN 促成 虚拟化 数据中心 爆发 
2015/4/22,000063.SZ,中兴通讯 多模 多频 Qcell 系统 实现 首个 全球 商用 
2015/4/22,000063.SZ,中兴通讯 重回 历史 高位 
2015/4/22,000063.SZ,西安交通 工程学院 与 中兴通讯 合作 取得成效 
2015/4/23,000063.SZ,中兴通讯 年 第一季度 报告 全文 
2015/4/23,000063.SZ,中兴 市值 首破 千亿 总裁 史立 荣称 五年 内进 前 二 
2015/4/23,000063.SZ,中兴通讯 年 一季度 净利 同比 增 
2015/4/23,000063.SZ,中兴通讯 首季 净利润 多 赚 近 
2015/4/23,000063.SZ,中兴通讯 Q 净利润 同比 增长 
2015/4/23,000063.SZ,中兴通讯 一季度 净利 亿 同比 增长 
2015/4/23,000063.SZ,中兴通讯 曾学忠 我们 在 日本 市场 增速 超 预期 
2015/4/23,000063.SZ,中国 重工 中兴通讯 等 股票 资金 流速 居前 
2015/4/23,000063.SZ,华为 P 发布 前 起诉 中兴 阴谋 还是 阳谋 
2015/4/24,000063.SZ,中兴通讯 业绩 超 预期 智慧 城市 业务 加速 落地 
2015/4/24,000063.SZ,中兴通讯 一季度 纯利 增 H股 涨 逾 
2015/4/24,000063.SZ,中兴通讯 业绩 符合 预期 创新 带动 成长 
2015/4/24,000063.SZ,光大 证券 中兴通讯 业绩 超 预期 市场竞争 格局 趋缓 公司 研究 
2015/4/24,000063.SZ,中兴通讯 一季度 净利润 同比 增 
2015/4/24,000063.SZ,花旗 中兴通讯 首季 业绩 强劲 目标价 上调 至元 
2015/4/24,000063.SZ,中兴通讯 信息 设备 龙头 业绩 大超 预期 
2015/4/24,000063.SZ,中兴 HK 升近 创近 四年 高 首季 多 赚瑞信 花旗 升价 
2015/4/24,000063.SZ,大 行 报告 高盛 维持 中兴 HK 中性 评级 目标价 上调 至元 
2015/4/24,000063.SZ,大 行 报告 花旗 中兴 HK 首季 业绩 强劲 目标价 上调 至元 
2015/4/24,000063.SZ,瑞信 中兴 中兴通讯 季绩 胜 预期 目标价 元 
2015/4/24,000063.SZ,中兴通讯 智慧 城市 进入 时代 
2015/4/24,000063.SZ,快讯 中兴通讯 一季度 纯利 增 H股 涨 
2015/4/24,000063.SZ,中兴通讯 跌 H股 升因 有惠理 撑 
2015/4/24,000063.SZ,中兴 一季度 营收 同比 增称 规模 年底 进前 三 
2015/4/24,000063.SZ,中兴 手机 专利 件 手机 语音 及 安全 技术 成 战略 重心 
2015/4/24,000063.SZ,手机 战国 CCTV 缘何 如此 青睐 中兴 三星 手机 指纹 可 被 黑客 复制 
2015/4/24,000063.SZ,中兴通讯 一季 赚 亿 同比 增长 
2015/4/24,000063.SZ,中兴通讯 一季度 盈利 增 四成 
2015/4/24,000063.SZ,美 地方法院 裁定 中兴通讯 未 侵犯 InterDigital 一项 技术 专利 
2015/4/24,000063.SZ,中兴通讯 一季度 盈利 
2015/4/25,000063.SZ,中兴通讯 何英 做 微商别 往 这些 坑里 跳 
2015/4/27,000063.SZ,中兴 手机 专利 超件 语音 及 安全 技术 成 战略 重心 
2015/4/27,000063.SZ,齐鲁 国际 前景 不俗 荐 中兴通讯 
2015/4/27,000063.SZ,国泰君安 中兴通讯 剑 指 万亿 养老 产业 增持 
2015/4/27,000063.SZ,国泰君安 证券 中兴通讯 中兴 健康 首次 亮相 剑 指 万亿 养老 产业 公司 研究 
2015/4/27,000063.SZ,中兴通讯 年 一 季报 点评 MICT 战略 竞争 优势 凸显 
2015/4/27,000063.SZ,连敬 涵 中兴通讯 佳绩 支持 
2015/4/27,000063.SZ,发改委 推进 新一代 信息 基础设施 建设 通信 行业 望 持续 受益 
2015/4/28,000063.SZ,浙商 证券 中兴通讯 一季度 净利 增 一带 一路 创新 驱动 动力 强劲 公司 研究 
2015/4/28,000063.SZ,中兴通讯 PPP 模式 推进 智慧 金华 直指 全国 一流 
2015/4/28,000063.SZ,G 来 了 中兴 亮相 亚太 智能 交通 论坛 大秀 肌肉 
2015/4/28,000063.SZ,中兴通讯 推行 阿米巴 经营 深入 事业部 内部 
2015/4/28,000063.SZ,中兴通讯 建立 智慧 健康 养老 云 平台 
2015/4/29,000063.SZ,中兴通讯 今日 交易 异动 涨跌幅 偏离 值 
2015/4/29,000063.SZ,中兴通讯 保利 地产 等 股票 资金 流速 居前 
2015/4/29,000063.SZ,中兴通讯 连云港 等 股票 资金 流速 居前 
2015/4/29,000063.SZ,上海 移动 携手 中兴通讯 建成 全球 最 大规模 GEPTN 商用 网络 
2015/4/29,000063.SZ,中兴通讯 将 日本 纳入 产业链 从 战略 高地 瞄 全球 
2015/4/30,000063.SZ,驶向 蓝海 中兴通讯 政企 产品 全国 巡展 正式 起航 
2015/4/30,000063.SZ,中 体 产业 中兴通讯 等 股票 资金 流速 居前 
2015/4/30,000063.SZ,交银 国际 维持 中兴通讯 中性 的 投资 评级 
2015/4/30,000063.SZ,中兴通讯 助力 江苏 电信 全球 领先 试用 K 超高 清 ITV 
2015/4/30,000063.SZ,利好 政策 助力 中兴通讯 涨停 
2015/5/4,000063.SZ,印媒 中兴通讯 子公司 拟 亿 投资 印度 智慧 城市 项目 
2015/5/4,000063.SZ,中兴通讯 助力 江苏 电信 领先 试用 K 超高 清 ITV 
2015/5/5,000063.SZ,胜利 证券 给予 中兴通讯 HK 持有 评级 
2015/5/6,000063.SZ,中兴通讯 发狠 话 给 所有 手机 配备 语音 控制系统 
2015/5/6,000063.SZ,国泰君安 国际 予 中兴通讯 买入 评级 看 港元 
2015/5/7,000063.SZ,中企 出海 新 征程 之三 中兴 在 美 扎根 之 赢 道 
2015/5/7,000063.SZ,惠誉 将 中兴通讯 评级 上调 至 BB 级 展望 稳定 
2015/5/8,000063.SZ,中国 电建 中兴通讯 等 股票 资金 流速 居前 
2015/5/9,000063.SZ,中 俄 合作 向 纵深 推进 中兴通讯 再 获 智慧 城市 大单 
2015/5/9,000063.SZ,中兴通讯 在 俄 斩获 亿 智慧 城市 订单 
2015/5/11,000063.SZ,瑞银 证券 中兴通讯 仍然 处于 基本面 的 上升 通道 公司 研究 
2015/5/11,000063.SZ,中兴通讯 受益 一路 一带 斩获 俄亿 智慧 城市 订单 
2015/5/11,000063.SZ,国泰君安 中兴通讯 斩获 俄亿 智慧 城市 订单 增持 
2015/5/11,000063.SZ,国泰君安 宽带 中国 发布 确立 通信 行业 铁公 基地 位 
2015/5/12,000063.SZ,中兴通讯 一键 式 无线 运维 系统 首度 亮相 亚洲 宽度 论坛 
2015/5/12,000063.SZ,中兴通讯 料 今年 电讯 及 企业 业务 销售额 年升 
2015/5/12,000063.SZ,中兴 HK 料 今年 亚太区 电讯 及 企业 业务 销售额 年升 
2015/5/12,000063.SZ,中兴通讯 料 今年 亚太区 电讯 及 企业 生意 增成 
2015/5/12,000063.SZ,公司 中兴通讯 G 智能机 现以 海外 销售 为主 
2015/5/12,000063.SZ,中兴通讯 关注 俄 等 海外 智慧 城市 项目 
2015/5/12,000063.SZ,中兴通讯 SDNIPRANDemo 首登 亚洲 宽带 论坛 
2015/5/12,000063.SZ,互动 中兴通讯 关注 俄 等 海外 智慧 城市 项目 
2015/5/13,000063.SZ,OVUM 中兴通讯 光 网络 以 份额 位居 亚太 之 首 
2015/5/13,000063.SZ,中兴通讯 光 网络 以 份额 位居 亚太 之 首 
2015/5/13,000063.SZ,中兴 携 先进 政企 产品 赴 全国 巡展 
2015/5/13,000063.SZ,中兴通讯 携手 AMD 推出 ZXCLOUDiBOXCTE 系 
2015/5/13,000063.SZ,OVUM 中兴通讯 光 网络 以 份额 位居 亚太 之 首 
2015/5/14,000063.SZ,富昌 证券 前景 向 好荐 中兴通讯 
2015/5/14,000063.SZ,快讯 通讯 板块 涨幅 居前 中兴通讯 直线 拉涨 超 
2015/5/15,000063.SZ,快讯 通讯设备 股 走势 分化 中兴通讯 H股 跌超 
2015/5/15,000063.SZ,快讯 G 概念 大跌 中兴通讯 跌 逾 
2015/5/18,000063.SZ,中兴 CloudUniCore 助 网络 虚拟化 落地 
2015/5/19,000063.SZ,中兴 光 网络 以 的 份额 居 亚太 之 首 
2015/5/20,000063.SZ,中兴通讯 发布 全球 首个 宽窄 带 融合 解决方案 
2015/5/20,000063.SZ,中兴通讯 现升 花旗 指 受惠 中国 制造 
2015/5/21,000063.SZ,中兴 HK 料 今年 付运 美国 智能手机 数量 增 
2015/5/21,000063.SZ,中兴通讯 GOTN 新品 获工 信部 入网 证 
2015/5/25,000063.SZ,消息 称 腾讯 NBA 将 推 定制 手机 是否 由 中兴 供货 成迷 
2015/5/25,000063.SZ,国电电力 中兴通讯 等 股票 资金 流速 居前 
2015/5/25,000063.SZ,中兴通讯 宁波 海运 等 股票 资金 流速 居前 
2015/5/25,000063.SZ,媒体 传 腾讯 NBA 将 推 定制 手机 或 由 中兴通讯 供货 
2015/5/25,000063.SZ,融慧 财经 关注 新 政策 下 的 机会 中兴通讯 值得 关注 
2015/5/26,000063.SZ,中兴通讯 为 铁路 行业 量身 打造 铁路 视讯 方案 
2015/5/27,000063.SZ,国泰君安 通信 行业 看好 以 工业 互联网 为主 线 投资 机会 
2015/5/28,000063.SZ,黄德 几 中兴通讯 积极 拓展 海外 市场前景 看俏 
2015/5/29,000063.SZ,江西 铜业 中兴通讯 等 股票 资金 流速 居前 
2015/6/1,000063.SZ,中兴通讯 香港 减持 中国 全通 万股 套现 万 港币 
2015/6/1,000063.SZ,中兴通讯 中国联通 等 股票 资金 流速 居前 
2015/6/1,000063.SZ,G 网络 技术 架构 白皮书 发布 圈定 中兴通讯 等 只 龙头股 
2015/6/1,000063.SZ,G 网络 技术 架构 白皮书 发布 三 维度 圈定 中兴通讯 等 只 龙头股 
2015/6/2,000063.SZ,中兴通讯 ZXDNA 演示 亮相 TMF 
2015/6/2,000063.SZ,中兴通讯 香港 减持 中国 全通 万 港币 
2015/6/3,000063.SZ,中兴通讯 签 智慧 珠海 合作 协议 探索 PPP 模式 
2015/6/3,000063.SZ,中兴 手机 签约 支持 腾讯 NBA 合作 打造 年轻化 品牌形象 
2015/6/4,000063.SZ,中兴通讯 试水 PPP 模式 掘金 智慧 城市 
2015/6/5,000063.SZ,ATT 授予 中兴 最佳 供应商 水晶 奖 唯一 中国 公司 
2015/6/5,000063.SZ,中兴 HK 夥 珠海 定 智慧 城市 合作 框架 
2015/6/8,000063.SZ,中兴通讯 香港 减持 中国 全通 万股 套现 万 港币 
2015/6/8,000063.SZ,中兴通讯 政企 巡展 济南 站 MICT 时代 安全 不 等待 
2015/6/8,000063.SZ,大 行 报告 瑞银 维持 中兴 HK 中性 评级 目标价 上调 至元 
2015/6/8,000063.SZ,中兴通讯 提出 智慧 城市 建设 PPP 模式 已 在 多个 城市 落地 
2015/6/8,000063.SZ,微 公交 如何 互联网 康迪 与 中兴通讯 携手 合作 
2015/6/8,000063.SZ,专访 中兴通讯 刘丰 创新 引领 中国 智慧 城市 迈向 时代 
2015/6/9,000063.SZ,编织 MICT 蓝图 中兴通讯 G 疾行 在 路上 
2015/6/9,000063.SZ,中兴通讯 减持 中国 全通 
2015/6/9,000063.SZ,中兴通讯 香港 减持 中国 全通 万 港币 
2015/6/10,000063.SZ,缸 边 娴 谈 黄惠娴 中兴通讯 业务 迎 国策 
2015/6/10,000063.SZ,中兴通讯 香港 减持 中国 全通 万 港币 
2015/6/10,000063.SZ,隧道 股份 中兴通讯 等 股票 资金 流速 居前 
2015/6/10,000063.SZ,珠海市 与 中兴通讯 签署 智慧 城市 战略 合作 协议 
2015/6/10,000063.SZ,新闻 中国联通 G 国干 集采 开标 华为 中兴通讯 中标 
2015/6/10,000063.SZ,中国联通 G 国干 集采 开标 华为 中兴通讯 中标 
2015/6/10,000063.SZ,中兴 旗下 努比亚 品牌 正式 独立 未来 三步走 
2015/6/11,000063.SZ,机构 调研 中兴通讯 关注 数据中心 业务 
2015/6/11,000063.SZ,公司 中兴通讯 竞争对手 减少 带来 更 多 机会 
2015/6/11,000063.SZ,公司 中兴通讯 通信 行业 仍 有 很大 投资 需求 
2015/6/12,000063.SZ,中兴通讯 香港 减持 中国 全通 亿 港币 
2015/6/15,000063.SZ,中兴通讯 成立 智慧 城市 学院 
2015/6/16,000063.SZ,中兴通讯 与 泉州市 签署 智慧 城市 合作 备忘录 
2015/6/17,000063.SZ,惠理 集团 增持 中兴通讯 万股 耗资 万 港币 
2015/6/17,000063.SZ,中兴通讯 亮相 年 LTE 全球 峰会 
2015/6/17,000063.SZ,中兴通讯 携手 广州 移动 与 Qualcomm 发布 LTEACat 三 载波 聚合 技术 试验 网速 为现 网倍 
2015/6/17,000063.SZ,中兴通讯 力推 按 需 部署 光 接入 方案 助力 运营商 步入 百兆 普及 时代 
2015/6/19,000063.SZ,中兴通讯 牵头 成立 大功率 无线 输电 产业 联盟 
2015/6/21,000063.SZ,黄兰香 会见 中兴通讯 董事长 侯为 贵 
2015/6/23,000063.SZ,瑞银 证券 调 高 中兴通讯 HK 至 买入 评级 
2015/6/23,000063.SZ,中兴通讯 全球 发布 紧凑型 PacketOTN 产品 ZXMPMCX 
2015/6/25,000063.SZ,中兴通讯 与 OFS 完成 G 超长 距 传输 测试 刷新 世界 记录 
2015/6/26,000063.SZ,中兴通讯 发布 八款 专业 集群 终端 满足 高 中低端 市场 
2015/7/2,000063.SZ,中国 全通 挫近 中兴通讯 转让 所持 换 股债 
2015/7/6,000063.SZ,科技 与 人文 相融 中兴通讯 政企 巡展 第二轮 启动 在 即 
2015/7/8,000063.SZ,公司 中兴通讯 高管 拟 出资 超万 增持 
2015/7/10,000063.SZ,公司 中兴通讯 正 筹划 回购 预计 不超 
2015/7/10,000063.SZ,中兴通讯 Qcell 在 中国电信 规模 部署 G 载波 聚合 获 商用 
2015/7/10,000063.SZ,中兴通讯 融资 融券 数据 
2015/7/10,000063.SZ,中兴 视通 如何 玩转 虚商 CoolCloud 云 平台 让 运营 更 简单 
2015/7/11,000063.SZ,中兴 加速 布局 G 未来 三年 拟 投资 约 亿 欧元 
2015/7/13,000063.SZ,惠理 集团 增持 中兴通讯 万股 耗资 亿 港币 
2015/7/13,000063.SZ,中兴通讯 拟 回购 股份 不超 
2015/7/13,000063.SZ,中兴通讯 与 日本 软银 签订 G 战略 合作 协议 
2015/7/13,000063.SZ,中兴通讯 庞胜清 一带 一路 战略 让 中兴通讯 迎 风化 龙 
2015/7/13,000063.SZ,中兴通讯 CTO 赵先 明三大 战略 助力 互联网 转型 
2015/7/13,000063.SZ,中兴通讯 引领 智慧 城市 建设 将成 PPP 模式 践 行者 让 信息技术 真正 惠及 民生 
2015/7/13,000063.SZ,中兴 分析师 大会 智慧 城市 破解 未来 城市 建设 谜题 
2015/7/13,000063.SZ,中兴通讯 赵先明 员工 创造 余件 黑 科技 创意 
2015/7/13,000063.SZ,中兴通讯 融资 融券 数据 
2015/7/13,000063.SZ,国泰君安 通信 行业 先抑 后扬 关注 中报 高 增长 个股 
2015/7/14,000063.SZ,中兴通讯 与 日本 软银 签订 PreG 联合 研发 谅解备忘录 
2015/7/14,000063.SZ,中兴通讯 智能化 将 是 云 计算 领域 发展 的 关键 路径 
2015/7/14,000063.SZ,G 要来 了 中兴 将 在 三年 内 推出 PreG 产品 
2015/7/14,000063.SZ,中兴通讯 股票 增持 及 回购 计划 充分 表明 处于 价值 洼地 
2015/7/14,000063.SZ,中兴通讯 极速 简单 开放 是 未来 宽带 的 显著 特征 
2015/7/14,000063.SZ,中兴通讯 鲁泰 A 徐工 机械 抛 巨资 回购 计划 盘中 均 巨量 封板 
2015/7/14,000063.SZ,大 行 报告 瑞信 参与 中兴 HK 分析 会议 後 维持 正面 重申 跑 赢大市 
2015/7/14,000063.SZ,中兴通讯 分享 行业 高 景气 增长 股份 回购 彰显 长期 发展 信心 
2015/7/14,000063.SZ,中兴通讯 回购 提振 H股 大涨 超 
2015/7/14,000063.SZ,华泰 证券 中兴通讯 看好 由 技术 优势 引领 的 转型 买入 
2015/7/14,000063.SZ,中兴通讯 拟 与 腾讯 合作 抽升 
2015/7/14,000063.SZ,野村 维持 中兴通讯 买入 评级 看元 
2015/7/14,000063.SZ,大 行 报告 野村 中兴通讯 HK 料 盈利 增长 续 强劲 维持 买入 
2015/7/14,000063.SZ,中兴通讯 在 香港 涨超 之前 公司 宣布 回购 计划 
2015/7/14,000063.SZ,中兴通讯 融资 融券 数据 
2015/7/14,000063.SZ,中兴通讯 拟斥 亿人币 回购 今复牌 
2015/7/14,000063.SZ,中兴 抛出 智慧 城市 PPP 模式 将 成大 趋势 
2015/7/14,000063.SZ,中兴通讯 拟 回购 股份 不超 兜底 股价 
2015/7/14,000063.SZ,中兴 智慧 城市 学院 将成 智慧 城市 建设 的 智慧 中枢 
2015/7/14,000063.SZ,智慧 城市 引入 PPP 中兴通讯 欲 复制 银川 模式 
2015/7/14,000063.SZ,中国电信 设备 商 强势 圈地 G 中兴通讯 再 获 软银 大单 
2015/7/14,000063.SZ,工信部 四 举措 推动 通信业 持续 发展 相关 行业 望 持续 受益 
2015/7/15,000063.SZ,中兴通讯 今日 交易 异动 三日 涨跌 累计 偏离 涨跌幅 偏离 值 
2015/7/15,000063.SZ,中兴通讯 海利 生物 等 股票 资金 流速 居前 
2015/7/15,000063.SZ,中兴通讯 推 新手机 欲 争当 美 第三 大 手机 制造商 
2015/7/15,000063.SZ,中兴通讯 融资 融券 数据 
2015/7/15,000063.SZ,中兴 涨停 H股 曾飙 
2015/7/15,000063.SZ,中兴通讯 在 美国 发布 新型 智能手机 
2015/7/16,000063.SZ,中兴通讯 正式 签约 成为 中国移动 OPNFV 实验室 首批 合作伙伴 
2015/7/16,000063.SZ,中兴通讯 POTN 成 传送 网 演进 方向 让 网络 变得 更加 灵活 开放 
2015/7/16,000063.SZ,中兴通讯 云管 融合 的 弹性 网络 为 未来 演进 方向 细节 将 决定 设备 商 成败 
2015/7/16,000063.SZ,中兴通讯 多 场景 覆盖 家族 又 添 新 成员 推 iMacro 新 概念 基站 
2015/7/16,000063.SZ,G 技术 有望 由 TDD 先行 中兴 TDD 率先 步入 商用 
2015/7/16,000063.SZ,中兴通讯 携手 上海 移动 打造 智能 光纤 管理系统 
2015/7/16,000063.SZ,中资 异动 中兴通讯 与 在 南韩 就 业务 签 合作 现升 逾 
2015/7/16,000063.SZ,互动 中兴通讯 与 国内 多家 新能源 车厂 合作 
2015/7/16,000063.SZ,曾学忠 中兴 布局 全球 市场 三年 内要 重返 国内 的 前 三 
2015/7/16,000063.SZ,流量 激增 让 传送 网 亚历山大 中兴 POTN 体现 分组 化 优势 
2015/7/16,000063.SZ,中兴通讯 融资 融券 数据 
2015/7/16,000063.SZ,机构 博弈 中兴通讯 两连板 
2015/7/17,000063.SZ,中兴通讯 中标 中国移动 哈尔滨 IDC 一期 工程 
2015/7/17,000063.SZ,中兴通讯 成为 中国移动 开放 实验室 首批 合作 夥伴 之一 
2015/7/17,000063.SZ,中兴通讯 与 韩国 电信 订 G 战略 合作 备忘 
2015/7/17,000063.SZ,中兴通讯 融资 融券 数据 
2015/7/17,000063.SZ,通信 设备 行业 扩展 海外 跑 赢大市 六股 腾飞 
2015/7/20,000063.SZ,中兴通讯 价值 严重 低估 买入 评级 
2015/7/20,000063.SZ,中兴通讯 融资 融券 数据 
2015/7/20,000063.SZ,高盛 高华 证券 中兴通讯 国内 设备 美国 智能手机 业务 稳健 国内 智能手机 海外 设备 业务 疲弱 公司 研究 
2015/7/21,000063.SZ,中兴通讯 上半年 净利 增成 G 产业 进入 业绩 兑现 期 
2015/7/21,000063.SZ,中兴 上半年 营收 同比 增长 
2015/7/21,000063.SZ,中兴通讯 今年 上半年 纯利 人币 按 年 上升 
2015/7/21,000063.SZ,中兴通讯 中 报 快报 业绩 同比 增 四成 
2015/7/21,000063.SZ,公司 中兴通讯 中期 净利 逾 亿 同比 增 
2015/7/21,000063.SZ,中兴 副总裁 刘鹏 农村 移动 互联网 将 大有可为 
2015/7/21,000063.SZ,中兴通讯 融资 融券 数据 
2015/7/22,000063.SZ,惠理 集团 减持 中兴通讯 万股 套现 万 港币 
2015/7/22,000063.SZ,惠理 基金管理 减持 中兴通讯 万股 每股 元 
2015/7/22,000063.SZ,中兴通讯 业绩 超 预期 价值 投资 首选 
2015/7/22,000063.SZ,中兴通讯 业绩 快报 G 和 政企 业务 推动 H 净利 增 
2015/7/22,000063.SZ,大 行 报告 瑞信 维持 中兴 HK 跑 赢大市 评级 目标价 上调 至元 
2015/7/22,000063.SZ,国企 红筹 中兴通讯 有望 今年 达售 万 智能手机 目标 
2015/7/22,000063.SZ,国泰君安 中兴通讯 中期 业绩 快报 点评 有线 无线 业务 齐 开花 中期 业绩 大幅 增长 公司 研究 
2015/7/22,000063.SZ,中兴通讯 融资 融券 数据 
2015/7/22,000063.SZ,中兴通讯 上半年 净利 增 逾 四成 M 
2015/7/23,000063.SZ,浙商 证券 中兴通讯 MICT 战略 驱动 业绩 稳步增长 公司 研究 
2015/7/23,000063.SZ,中信 建投 中兴通讯 业绩 超 预期 价值 投资 首选 买入 
2015/7/23,000063.SZ,中兴 千万元 出售 香港 一 运营商 控股权 给 公司 
2015/7/23,000063.SZ,中兴通讯 融资 融券 数据 
2015/7/23,000063.SZ,中兴通讯 分享 行业 景气 收获 靓丽 业绩 加快 新 业务 拓展 布局 长期 发展 
2015/7/23,000063.SZ,中兴 造 出 智能 旗舰 手机 
2015/7/23,000063.SZ,中兴通讯 中期 业绩 大幅 增长 增持 评级 
2015/7/24,000063.SZ,中兴通讯 融资 融券 数据 
2015/7/27,000063.SZ,电讯 设备 投资 力度 加大 龙头股 中兴通讯 继续 受惠 
2015/7/27,000063.SZ,中兴通讯 布局 新兴 领域 筑基 未来 业绩 增长 构建 安全 边际 
2015/7/27,000063.SZ,中兴通讯 融资 融券 数据 
2015/7/27,000063.SZ,中兴通讯 上半年 预计 营收 增长 
2015/7/28,000063.SZ,中兴通讯 业绩 超 预期 营收 和 毛利率 双升 增长 
2015/7/28,000063.SZ,中兴通讯 融资 融券 数据 
2015/7/29,000063.SZ,中兴通讯 发布 新 空间 战略 
2015/7/29,000063.SZ,中兴通讯 基本面 与 估值 并重 
2015/7/29,000063.SZ,中兴通讯 融资 融券 数据 
2015/7/29,000063.SZ,中兴 手机 进军 高端 市场 放言 三年 进入 全国 前 三 
2015/7/30,000063.SZ,中兴通讯 获 中国移动 CMIMS 二期 含 VoLTE 招标 最大 份额 
2015/7/30,000063.SZ,中兴通讯 中标 中国移动 哈尔滨 IDC 一期 工程 
2015/7/30,000063.SZ,深度 解析 中移 VoLTE 风云变幻 中兴 何以 最大 赢家 
2015/7/30,000063.SZ,中兴通讯 融资 融券 数据 
2015/7/31,000063.SZ,中兴通讯 融资 融券 数据 
2015/8/3,000063.SZ,程 立新 NBA 能否 支撑 中兴 手机 的 美国 梦 
2015/8/3,000063.SZ,中兴通讯 融资 融券 数据 
2015/8/3,000063.SZ,通信 行业 一周 谈 日本 遭美 监听 继续 关注 网络安全 龙头股 招商 证券 
2015/8/4,000063.SZ,国企 红筹 中兴通讯 与 合作 发展 马 国 技术 
2015/8/4,000063.SZ,品 中资 罗国森 中兴通讯 可以 去 得 几尽 
2015/8/4,000063.SZ,中兴通讯 融资 融券 数据 
2015/8/5,000063.SZ,惠理 基金管理 减持 中兴通讯 万股 每股 元 
2015/8/5,000063.SZ,融慧 财经 通讯设备 需求 大增 中兴通讯 上望 元 
2015/8/5,000063.SZ,中兴通讯 融资 融券 数据 
2015/8/6,000063.SZ,海王 生物 中兴通讯 等 股票 资金 流速 居前 
2015/8/6,000063.SZ,中兴通讯 融资 融券 数据 
2015/8/7,000063.SZ,中兴通讯 融资 融券 数据 
2015/8/7,000063.SZ,规划 G 标准 中兴通讯 提 频段 划分 方案 
2015/8/10,000063.SZ,中兴通讯 融资 融券 数据 
2015/8/11,000063.SZ,中兴通讯 融资 融券 数据 
2015/8/12,000063.SZ,陕西 制造 中兴 AXON 天机 面向 全球 市场 销售 
2015/8/12,000063.SZ,中兴通讯 融资 融券 数据 
2015/8/13,000063.SZ,G 开议 频率 规划 中兴通讯 提 G 频段 划分 方案 
2015/8/13,000063.SZ,中兴通讯 与 UMobile 签署 G 战略 合作 谅解备忘录 
2015/8/13,000063.SZ,中兴通讯 融资 融券 数据 
2015/8/14,000063.SZ,中兴通讯 融资 融券 数据 
2015/8/17,000063.SZ,惠理 基金管理 减持 中兴通讯 万股 每股 元 
2015/8/17,000063.SZ,中兴通讯 融资 融券 数据 
2015/8/18,000063.SZ,中兴通讯 融资 融券 数据 
2015/8/18,000063.SZ,惠理 集团 减持 中兴通讯 万股 套现 万 港币 
2015/8/18,000063.SZ,券商 行业 研究 观点 汇总 通信 板块 未来 行情 将 在 波动 中 进行 
2015/8/19,000063.SZ,中兴通讯 助力 印尼 通讯 基础设施 建设 
2015/8/19,000063.SZ,中兴通讯 融资 融券 数据 
2015/8/20,000063.SZ,中兴通讯 股东会 通过 发亿人币 短融 
2015/8/20,000063.SZ,中兴通讯 提速 云 计算 助力 中国联通 拓展 云 服务 市场 
2015/8/20,000063.SZ,万达 信息 中兴通讯 等 与 金山区 签约 共推 智慧 城市 建设 
2015/8/20,000063.SZ,中兴通讯 融资 融券 数据 
2015/8/21,000063.SZ,中兴通讯 融资 融券 数据 
2015/8/23,000063.SZ,中兴通讯 举办 关爱 中国 远征军 滇西 抗战 老兵 图片展 
2015/8/24,000063.SZ,中兴通讯 融资 融券 数据 
2015/8/25,000063.SZ,中兴通讯 融资 融券 数据 
2015/8/26,000063.SZ,受益 全球 G 规模 部署 中兴通讯 上半年 净利 增逾成 
2015/8/26,000063.SZ,中兴通讯 财年 上半年 盈利 亿 人民币 同比 增长 
2015/8/26,000063.SZ,国企 红筹 中兴通讯 上半年 纯利 升至 不 派息 
2015/8/26,000063.SZ,中兴通讯 上半年 纯利 升至 人币 不 派息 
2015/8/26,000063.SZ,中 报 中兴通讯 中期 净利 亿 同比 增长 
2015/8/26,000063.SZ,印度 G 基础设施 规模 超 亿美元 中兴通讯 参建 
2015/8/26,000063.SZ,中兴通讯 融资 融券 数据 
2015/8/27,000063.SZ,中兴通讯 受益 通信 建设 高潮 估值 见底 
2015/8/27,000063.SZ,中兴通讯 中 报 点评 中期 业绩 大幅 增长 抢占 G 卡位 物 联网 
2015/8/27,000063.SZ,互动 中兴通讯 半年 多 赚 兼 获高 管增 持股 涨近 
2015/8/27,000063.SZ,中资 异动 中兴通讯 上半年 纯利 升现 升近 一成 
2015/8/27,000063.SZ,中金公司 维持 中兴通讯 HK 推荐 评级 
2015/8/27,000063.SZ,中兴通讯 融资 融券 数据 
2015/8/27,000063.SZ,中兴通讯 财年 第二 财季 盈利 亿 人民币 同比 增长 
